{
  "id": "level-1",
  "name": "Teddy Bear",
  "grid": {
    "width": 42,
    "height": 42
  },
  "arrows": [
    {
      "id": "001",
      "head_pos": {
        "x": 37,
        "y": 35
      },
      "direction": "up",
      "tail_path": [
        {
          "x": 37,
          "y": 36
        },
        {
          "x": 37,
          "y": 37
        },
        {
          "x": 37,
          "y": 38
        },
        {
          "x": 37,
          "y": 39
        },
        {
          "x": 36,
          "y": 39
        },
        {
          "x": 36,
          "y": 38
        },
        {
          "x": 35,
          "y": 38
        },
        {
          "x": 35,
          "y": 39
        },
        {
          "x": 34,
          "y": 39
        },
        {
          "x": 34,
          "y": 40
        },
        {
          "x": 33,
          "y": 40
        },
        {
          "x": 32,
          "y": 40
        },
        {
          "x": 32,
          "y": 39
        },
        {
          "x": 33,
          "y": 39
        },
        {
          "x": 33,
          "y": 38
        },
        {
          "x": 33,
          "y": 37
        },
        {
          "x": 34,
          "y": 37
        },
        {
          "x": 35,
          "y": 37
        },
        {
          "x": 36,
          "y": 37
        },
        {
          "x": 36,
          "y": 36
        },
        {
          "x": 36,
          "y": 35
        },
        {
          "x": 35,
          "y": 35
        },
        {
          "x": 34,
          "y": 35
        },
        {
          "x": 33,
          "y": 35
        },
        {
          "x": 33,
          "y": 34
        },
        {
          "x": 33,
          "y": 33
        },
        {
          "x": 32,
          "y": 33
        },
        {
          "x": 31,
          "y": 33
        },
        {
          "x": 30,
          "y": 33
        },
        {
          "x": 30,
          "y": 32
        },
        {
          "x": 31,
          "y": 32
        },
        {
          "x": 32,
          "y": 32
        }
      ]
    },
    {
      "id": "002",
      "head_pos": {
        "x": 9,
        "y": 26
      },
      "direction": "left",
      "tail_path": [
        {
          "x": 10,
          "y": 26
        },
        {
          "x": 10,
          "y": 27
        },
        {
          "x": 10,
          "y": 28
        },
        {
          "x": 10,
          "y": 29
        },
        {
          "x": 11,
          "y": 29
        },
        {
          "x": 11,
          "y": 30
        },
        {
          "x": 12,
          "y": 30
        },
        {
          "x": 12,
          "y": 31
        },
        {
          "x": 13,
          "y": 31
        },
        {
          "x": 13,
          "y": 32
        },
        {
          "x": 13,
          "y": 33
        },
        {
          "x": 12,
          "y": 33
        },
        {
          "x": 11,
          "y": 33
        },
        {
          "x": 11,
          "y": 34
        },
        {
          "x": 11,
          "y": 35
        },
        {
          "x": 12,
          "y": 35
        },
        {
          "x": 12,
          "y": 34
        },
        {
          "x": 13,
          "y": 34
        },
        {
          "x": 14,
          "y": 34
        },
        {
          "x": 14,
          "y": 35
        },
        {
          "x": 13,
          "y": 35
        },
        {
          "x": 13,
          "y": 36
        },
        {
          "x": 13,
          "y": 37
        },
        {
          "x": 14,
          "y": 37
        },
        {
          "x": 15,
          "y": 37
        },
        {
          "x": 15,
          "y": 36
        },
        {
          "x": 15,
          "y": 35
        },
        {
          "x": 15,
          "y": 34
        },
        {
          "x": 15,
          "y": 33
        },
        {
          "x": 14,
          "y": 33
        },
        {
          "x": 14,
          "y": 32
        },
        {
          "x": 15,
          "y": 32
        },
        {
          "x": 16,
          "y": 32
        },
        {
          "x": 16,
          "y": 33
        },
        {
          "x": 16,
          "y": 34
        },
        {
          "x": 16,
          "y": 35
        },
        {
          "x": 17,
          "y": 35
        },
        {
          "x": 18,
          "y": 35
        },
        {
          "x": 19,
          "y": 35
        },
        {
          "x": 19,
          "y": 36
        },
        {
          "x": 18,
          "y": 36
        }
      ]
    },
    {
      "id": "003",
      "head_pos": {
        "x": 21,
        "y": 35
      },
      "direction": "up",
      "tail_path": [
        {
          "x": 21,
          "y": 36
        },
        {
          "x": 20,
          "y": 36
        },
        {
          "x": 20,
          "y": 35
        }
      ]
    },
    {
      "id": "004",
      "head_pos": {
        "x": 26,
        "y": 36
      },
      "direction": "left",
      "tail_path": [
        {
          "x": 27,
          "y": 36
        },
        {
          "x": 27,
          "y": 37
        },
        {
          "x": 26,
          "y": 37
        }
      ]
    },
    {
      "id": "005",
      "head_pos": {
        "x": 30,
        "y": 15
      },
      "direction": "left",
      "tail_path": [
        {
          "x": 31,
          "y": 15
        },
        {
          "x": 31,
          "y": 14
        },
        {
          "x": 30,
          "y": 14
        },
        {
          "x": 29,
          "y": 14
        },
        {
          "x": 28,
          "y": 14
        },
        {
          "x": 27,
          "y": 14
        },
        {
          "x": 27,
          "y": 13
        },
        {
          "x": 28,
          "y": 13
        },
        {
          "x": 28,
          "y": 12
        },
        {
          "x": 28,
          "y": 11
        },
        {
          "x": 29,
          "y": 11
        },
        {
          "x": 29,
          "y": 12
        },
        {
          "x": 29,
          "y": 13
        },
        {
          "x": 30,
          "y": 13
        },
        {
          "x": 31,
          "y": 13
        },
        {
          "x": 31,
          "y": 12
        },
        {
          "x": 32,
          "y": 12
        },
        {
          "x": 32,
          "y": 11
        },
        {
          "x": 32,
          "y": 10
        },
        {
          "x": 32,
          "y": 9
        },
        {
          "x": 32,
          "y": 8
        },
        {
          "x": 33,
          "y": 8
        },
        {
          "x": 33,
          "y": 7
        },
        {
          "x": 32,
          "y": 7
        },
        {
          "x": 32,
          "y": 6
        },
        {
          "x": 32,
          "y": 5
        },
        {
          "x": 32,
          "y": 4
        },
        {
          "x": 33,
          "y": 4
        },
        {
          "x": 34,
          "y": 4
        },
        {
          "x": 34,
          "y": 5
        },
        {
          "x": 33,
          "y": 5
        },
        {
          "x": 33,
          "y": 6
        },
        {
          "x": 34,
          "y": 6
        },
        {
          "x": 34,
          "y": 7
        }
      ]
    },
    {
      "id": "006",
      "head_pos": {
        "x": 30,
        "y": 6
      },
      "direction": "right",
      "tail_path": [
        {
          "x": 29,
          "y": 6
        },
        {
          "x": 28,
          "y": 6
        },
        {
          "x": 28,
          "y": 5
        },
        {
          "x": 27,
          "y": 5
        },
        {
          "x": 27,
          "y": 4
        },
        {
          "x": 28,
          "y": 4
        },
        {
          "x": 29,
          "y": 4
        },
        {
          "x": 30,
          "y": 4
        },
        {
          "x": 30,
          "y": 5
        },
        {
          "x": 31,
          "y": 5
        },
        {
          "x": 31,
          "y": 4
        },
        {
          "x": 31,
          "y": 3
        },
        {
          "x": 30,
          "y": 3
        },
        {
          "x": 29,
          "y": 3
        }
      ]
    },
    {
      "id": "007",
      "head_pos": {
        "x": 17,
        "y": 20
      },
      "direction": "right",
      "tail_path": [
        {
          "x": 16,
          "y": 20
        },
        {
          "x": 16,
          "y": 19
        },
        {
          "x": 15,
          "y": 19
        },
        {
          "x": 15,
          "y": 20
        },
        {
          "x": 15,
          "y": 21
        },
        {
          "x": 15,
          "y": 22
        },
        {
          "x": 14,
          "y": 22
        },
        {
          "x": 14,
          "y": 23
        },
        {
          "x": 15,
          "y": 23
        },
        {
          "x": 16,
          "y": 23
        },
        {
          "x": 16,
          "y": 24
        },
        {
          "x": 16,
          "y": 25
        },
        {
          "x": 17,
          "y": 25
        },
        {
          "x": 17,
          "y": 26
        },
        {
          "x": 17,
          "y": 27
        },
        {
          "x": 18,
          "y": 27
        },
        {
          "x": 18,
          "y": 28
        },
        {
          "x": 18,
          "y": 29
        },
        {
          "x": 19,
          "y": 29
        },
        {
          "x": 19,
          "y": 28
        },
        {
          "x": 19,
          "y": 27
        },
        {
          "x": 20,
          "y": 27
        },
        {
          "x": 21,
          "y": 27
        },
        {
          "x": 22,
          "y": 27
        },
        {
          "x": 23,
          "y": 27
        },
        {
          "x": 24,
          "y": 27
        },
        {